{
  "$schema": "../schema.json",
  "generation": "v1",
  "baseUrl": "https://api.aryeo.com/v1",
  "auth": {
    "scheme": "bearer",
    "header": "Authorization"
  },
  "defaults": {
    "perPage": 100,
    "perPageMax": 100,
    "filterStyle": "bracketed",
    "enumCase": "lower"
  },
  "operations": {
    "orders.list": {
      "path": "/orders",
      "method": "GET",
      "summary": "The job record: what was bought, when it is shot, who shoots it.",
      "availability": {
        "state": "available"
      },
      "paginated": true,
      "perPageMax": 100,
      "filters": {
        "search": {
          "wire": "filter[search]",
          "state": "honoured",
          "type": "string",
          "note": "Matches order number and address.",
          "evidence": {
            "file": "2026-08-29-orders.json",
            "date": "2026-08-29",
            "measurement": "1 of 5383 for a known order number"
          }
        },
        "appointmentStartAtGte": {
          "wire": "filter[appointment_start_at_gte]",
          "state": "honoured",
          "type": "datetime",
          "evidence": {
            "file": "2026-08-29-orders.json",
            "date": "2026-08-29",
            "measurement": "278 of 5383 over 30 days"
          }
        },
        "appointmentStartAtLte": {
          "wire": "filter[appointment_start_at_lte]",
          "state": "honoured",
          "type": "datetime",
          "evidence": {
            "file": "2026-08-29-orders.json",
            "date": "2026-08-29",
            "measurement": "278 of 5383 over 30 days"
          }
        },
        "createdAtGte": {
          "wire": "filter[created_at_gte]",
          "state": "honoured",
          "type": "datetime",
          "evidence": {
            "file": "2026-08-29-orders.json",
            "date": "2026-08-29",
            "measurement": "310 of 5383 over 30 days"
          }
        },
        "createdAtLte": {
          "wire": "filter[created_at_lte]",
          "state": "honoured",
          "type": "datetime",
          "evidence": {
            "file": "2026-08-29-orders.json",
            "date": "2026-08-29",
            "measurement": "310 of 5383 over 30 days"
          }
        },
        "appointmentStatus": {
          "wire": "filter[appointment_status]",
          "state": "honoured",
          "type": "string",
          "enum": [
            "scheduled",
            "unscheduled",
            "canceled"
          ],
          "evidence": {
            "file": "2026-08-29-orders.json",
            "date": "2026-08-29",
            "measurement": "5072 of 5383 for scheduled"
          }
        },
        "userIds": {
          "wire": "filter[user_ids]",
          "state": "honoured",
          "type": "array",
          "arrayForm": "indexed",
          "note": "Company team member ids. This is how you ask what one photographer shot.",
          "evidence": {
            "file": "2026-08-29-orders.json",
            "date": "2026-08-29",
            "measurement": "partitions across 7 members: 0, 630, 38, 0, 3025, 275, 1342"
          }
        },
        "status": {
          "wire": "filter[status]",
          "state": "honoured",
          "type": "string",
          "enum": [
            "open",
            "draft",
            "canceled",
            "confirmed"
          ],
          "note": "Filters the order lifecycle, which is not the same field as the response status. Most live orders are open even though their response status reads CONFIRMED."
        },
        "paymentStatus": {
          "wire": "filter[payment_status]",
          "state": "honoured",
          "type": "string",
          "enum": [
            "paid",
            "unpaid",
            "partially_paid"
          ]
        },
        "fulfillmentStatus": {
          "wire": "filter[fulfillment_status]",
          "state": "honoured",
          "type": "string",
          "enum": [
            "fulfilled",
            "unfulfilled",
            "partially_fulfilled"
          ]
        },
        "listingId": {
          "state": "ignored",
          "type": "uuid",
          "strategy": "client-side",
          "note": "filter[listing_id], filter[listing] and filter[listing_ids][] were each accepted and each returned the full collection.",
          "evidence": {
            "file": "2026-08-29-orders.json",
            "date": "2026-08-29",
            "measurement": "5383 of 5383, unchanged"
          }
        }
      },
      "sorts": [
        "appointment_start",
        "-appointment_start",
        "created_at",
        "-created_at"
      ],
      "includes": [
        "items",
        "itemsCount",
        "itemsExists",
        "tags",
        "tagsCount",
        "tagsExists",
        "customer",
        "customerGroup",
        "listing",
        "appointments",
        "appointments.users",
        "unconfirmed_appointments",
        "order_form",
        "discounts",
        "discounts.coupon",
        "payments",
        "taxes"
      ],
      "responseEnums": {
        "status": [
          "CONFIRMED",
          "DRAFT",
          "CANCELED"
        ],
        "payment_status": [
          "PAID",
          "UNPAID",
          "PARTIALLY_PAID"
        ],
        "fulfillment_status": [
          "FULFILLED",
          "UNFULFILLED",
          "PARTIALLY_FULFILLED"
        ]
      },
      "quirks": [
        "There is no address, agents or group include here. The assigned photographer is appointments.users.",
        "Line items come back without any product identity. See orderItems.get."
      ],
      "evidence": {
        "file": "2026-08-29-orders.json",
        "date": "2026-08-29"
      }
    },
    "orders.get": {
      "path": "/orders/{orderId}",
      "method": "GET",
      "availability": {
        "state": "available"
      },
      "pathParams": {
        "orderId": {
          "type": "uuid",
          "required": true
        }
      },
      "includes": [
        "items",
        "tags",
        "customer",
        "customerGroup",
        "listing",
        "appointments",
        "appointments.users",
        "unconfirmed_appointments",
        "order_form",
        "discounts",
        "discounts.coupon",
        "payments",
        "taxes"
      ],
      "quirks": [
        "include=items.product is rejected. Product identity is only on the order item detail route."
      ],
      "evidence": {
        "file": "2026-08-29-orders.json",
        "date": "2026-08-29"
      }
    },
    "orders.paymentInfo.get": {
      "path": "/orders/{orderId}/payment-info",
      "method": "GET",
      "summary": "Amount, upfront percentage, currency and tipping configuration.",
      "availability": {
        "state": "available"
      },
      "pathParams": {
        "orderId": {
          "type": "uuid",
          "required": true
        }
      },
      "evidence": {
        "file": "2026-08-29-orders.json",
        "date": "2026-08-29"
      }
    },
    "orderItems.get": {
      "path": "/order-items/{orderItemId}",
      "method": "GET",
      "summary": "A single line item, and the only route that exposes the catalogue product behind it.",
      "availability": {
        "state": "available"
      },
      "pathParams": {
        "orderItemId": {
          "type": "uuid",
          "required": true
        }
      },
      "includes": [
        "product",
        "product_variant",
        "order",
        "order.company",
        "appointment",
        "taxes",
        "discount_amounts",
        "discount_amounts.discount",
        "discount_amounts.discount.coupon",
        "tasks",
        "tasks.company_team_member",
        "tasks.company_team_member.user"
      ],
      "quirks": [
        "product_variant.duration is the configured shoot length for that line, which is what appointment length should be derived from.",
        "This is also the only reliable way to reach the tasks attached to an order."
      ],
      "evidence": {
        "file": "2026-08-29-orders.json",
        "date": "2026-08-29",
        "measurement": "product.id present, product_variant.duration 30"
      }
    },
    "orders.deliver": {
      "path": "/orders/{orderId}/deliver",
      "method": "POST",
      "summary": "Publishes the listing and emails the agent.",
      "availability": {
        "state": "unverified",
        "note": "Described from production code in the Envesko estate. Never exercised by this repository, because exercising it would publish somebody's listing."
      },
      "mutates": true,
      "confirmation": {
        "kind": "echoIdentifier",
        "field": "number",
        "warns": "Publishes the Aryeo listing and emails the agent. They see it within seconds and it cannot be recalled."
      },
      "pathParams": {
        "orderId": {
          "type": "uuid",
          "required": true
        }
      },
      "evidence": {
        "file": "2026-08-29-writes.json",
        "date": "2026-08-29",
        "source": "production"
      }
    },
    "orders.create": {
      "path": "/orders",
      "method": "POST",
      "summary": "Creates an order upstream.",
      "availability": {
        "state": "unverified",
        "note": "Described from production code. Body fields are not yet enumerated here, because guessing them is how you create malformed orders on somebody's account."
      },
      "mutates": true,
      "confirmation": {
        "kind": "echoIdentifier",
        "field": "number",
        "warns": "Creates a real order upstream."
      },
      "evidence": {
        "file": "2026-08-29-writes.json",
        "date": "2026-08-29",
        "source": "production"
      }
    },
    "listings.list": {
      "path": "/listings",
      "method": "GET",
      "summary": "The property and everything shot for it.",
      "availability": {
        "state": "available"
      },
      "paginated": true,
      "perPageMax": 100,
      "filters": {